{
  "safety_warnings": [
    "This plan is not a guarantee of recovery.",
    "Use only official recovery channels.",
    "Do not try to bypass MFA, guess passwords, phish, or access accounts without authorization."
  ],
  "hardening_steps": [
    "Generate and safely store new backup codes.",
    "Add a passkey where the service supports it.",
    "Update recovery email and phone number.",
    "Store recovery details in a trusted password manager.",
    "Document business admin access and recovery contacts."
  ],
  "incident_records": {
    "gmail_mfa_loss": {
      "case_type": "lost_mfa_device",
      "service_aliases": [
        "google",
        "gmail"
      ],
      "title": "Lost MFA device for a Google account",
      "support_summary": "I lost access to my authenticator app for a Google account and need help through the official recovery flow.",
      "last_verified_at": "2026-06-19",
      "review_due_at": "2026-07-19",
      "review_cadence_days": 30,
      "confidence": "high",
      "status": "verified",
      "stale": false,
      "checklist": [
        "Try backup codes before any other recovery path.",
        "Check whether a trusted device is still signed in to the Google account.",
        "Use the Google account recovery flow instead of repeated sign-in attempts.",
        "Prepare device history, recovery email access, and account timeline details.",
        "Wait for official recovery checkpoints instead of spamming the form."
      ],
      "ownership_evidence": [
        "Backup codes if available.",
        "Trusted device details and recent sign-in context.",
        "Recovery email still under your control.",
        "Approximate account creation date.",
        "Recent Google subscription or billing records."
      ],
      "common_mistakes": [
        "Submitting too many recovery attempts in a short period.",
        "Trying random old passwords after the account starts challenging recovery.",
        "Ignoring a trusted signed-in device that can confirm identity faster."
      ],
      "official_links": [
        {
          "label": "Google Account Recovery",
          "url": "https://accounts.google.com/signin/recovery"
        },
        {
          "label": "Google Help: Account Recovery",
          "url": "https://support.google.com/accounts/answer/7682439"
        }
      ],
      "source_notes": [
        "Google recovery is strongest when the user stays consistent with devices, networks, and the official recovery flow.",
        "Backup codes and existing trusted sessions should be used before more expensive recovery paths."
      ],
      "default_guidance": {
        "id": "google_recovery_context",
        "next_best_action": "Use the Google account recovery page from a familiar device context and answer every prompt consistently instead of experimenting with multiple paths.",
        "prepare_now": [
          "The same device, same browser, and same network you normally used with the account.",
          "Recovery email access and recent account activity details.",
          "A short account timeline including when MFA access was lost."
        ],
        "what_can_make_this_worse": [
          "Too many recovery attempts from different devices, browsers, or networks.",
          "Submitting different stories or different account details across retries.",
          "Ignoring a still-working recovery email path while forcing manual review."
        ],
        "escalate_when": [
          "The recovery form keeps failing after you try from the same browser, same network, and a stable account timeline.",
          "You lose control of the recovery email during the recovery process."
        ],
        "expected_timeline": "often hours to several days if Google has to rely on account history instead of a live trusted factor",
        "checklist_additions": [
          "Stay on the same browser and recovery context until Google finishes the review."
        ]
      },
      "decision_paths": [
        {
          "id": "backup_codes_available",
          "when": {
            "has_backup_codes": true
          },
          "next_best_action": "Use a backup code first, then immediately remove the lost authenticator method and enroll a new second factor.",
          "prepare_now": [
            "The backup code set or a secure copy of it.",
            "A trusted signed-in device or browser session in case Google asks for confirmation.",
            "Your recovery email and recent Google billing or subscription context."
          ],
          "what_can_make_this_worse": [
            "Burning multiple backup codes without finishing account recovery and re-enrollment.",
            "Too many recovery attempts after a backup code path already works.",
            "Removing the wrong device before you verify access is fully restored."
          ],
          "escalate_when": [
            "A backup code is rejected even though it was never used and the account details match.",
            "The account opens but you still cannot remove the lost MFA method."
          ],
          "expected_timeline": "immediate if backup codes or a trusted session still work",
          "checklist_additions": [
            "Generate fresh backup codes after sign-in succeeds.",
            "Remove the lost authenticator from the account before you sign out."
          ],
          "support_summary_addition": "Once access is restored, I need to replace the lost authenticator and generate fresh backup codes."
        },
        {
          "id": "trusted_device_still_signed_in",
          "when": {
            "has_backup_codes": false,
            "has_trusted_device": true
          },
          "next_best_action": "Use the trusted signed-in device to confirm the login and replace the lost authenticator method before trying broader recovery.",
          "prepare_now": [
            "The exact device and browser that still has a working Google session.",
            "Your recovery email and approximate account creation period.",
            "Recent Google billing or subscription details."
          ],
          "what_can_make_this_worse": [
            "Signing out of the last trusted session before the account is stable again.",
            "Trying random passwords or repeated recovery attempts from new devices.",
            "Changing recovery details before MFA access is restored."
          ],
          "escalate_when": [
            "The trusted device no longer offers a confirmation or recovery option.",
            "Google starts rejecting consistent trusted-session recovery attempts."
          ],
          "expected_timeline": "same session if the trusted device still receives prompts or can reach account settings"
        },
        {
          "id": "high_friction_identity_review",
          "when": {
            "still_knows_password": false,
            "has_backup_codes": false,
            "has_recovery_email": false,
            "has_trusted_device": false
          },
          "next_best_action": "Use the Google recovery form as a high-friction identity review path and prepare the strongest account-history evidence you can before retrying.",
          "prepare_now": [
            "Approximate account creation date, older passwords, and the names of Google services used on the account.",
            "Recent contacts, labels, or mailbox patterns you can consistently describe if Google prompts for history.",
            "Any billing, YouTube, Google One, or Play purchase history linked to the account."
          ],
          "what_can_make_this_worse": [
            "Trying to guess old passwords repeatedly after the account is already in recovery review.",
            "Changing devices or networks between every recovery attempt.",
            "Submitting weak or contradictory account history details."
          ],
          "escalate_when": [
            "You can provide a consistent account history but the recovery form still fails repeatedly.",
            "The account is a recovery anchor for other critical accounts and delays are causing cascading lockouts."
          ],
          "expected_timeline": "longer than normal because Google may rely almost entirely on identity and account-history signals",
          "checklist_additions": [
            "Expect identity review may take longer when no password, recovery email, or trusted device still works."
          ]
        }
      ]
    },
    "apple_trusted_device_loss": {
      "case_type": "changed_phone_number",
      "service_aliases": [
        "apple",
        "icloud",
        "apple id"
      ],
      "title": "Lost trusted device or trusted phone for Apple ID recovery",
      "support_summary": "I lost access to a trusted Apple device or trusted phone number and need to recover access through Apple's official process.",
      "last_verified_at": "2026-06-19",
      "review_due_at": "2026-07-19",
      "review_cadence_days": 30,
      "confidence": "high",
      "status": "verified",
      "stale": false,
      "checklist": [
        "Check whether any trusted Apple device is still signed in.",
        "Try trusted phone or recovery email paths before starting a full account recovery wait period.",
        "Use the official Apple recovery page and keep the same recovery context during review.",
        "Prepare purchase, device, and account ownership details.",
        "Do not remove old trusted numbers or devices until access is restored."
      ],
      "ownership_evidence": [
        "Trusted device details.",
        "Trusted phone details if still under your control.",
        "Recovery email still under your control.",
        "Proof of Apple device or account ownership.",
        "Billing or subscription records."
      ],
      "common_mistakes": [
        "Starting account recovery before checking a still-signed-in trusted Apple device.",